<?xml version="1.0" encoding="UTF-8"?>
<!DOCTYPE sitio SYSTEM "../esquema/sitio.dtd">
<!-- Sitio de prueba en inglés, sin imágenes y solo con algunas secciones.
     Comprueba que los caracteres especiales del texto no rompen el HTML. -->
<sitio autor="Ana &amp; Co." idioma="en"
       xmlns:xsi="http://www.w3.org/2001/XMLSchema-instance"
       xsi:noNamespaceSchemaLocation="../esquema/sitio.xsd">
  <perfil>
    <resumen>Film student &amp; amateur photographer. Test site with only some sections.</resumen>
    <parrafo>Caracteres especiales: &lt;b&gt;no se interpretan&lt;/b&gt; y "las comillas" tampoco rompen nada.</parrafo>
    <dato etiqueta="City">Valencia</dato>
    <contacto etiqueta="Web" enlace="https://example.org">example.org</contacto>
  </perfil>
  <series titulo="Series I love">
    <serie titulo="Twin Peaks" genero="Mystery" anio="1990" favorita="true">Sin imagen: se muestra la imagen por defecto.</serie>
    <serie titulo="Severance" genero="Sci-Fi" anio="2022" actual="true">Otra descripción.</serie>
  </series>
  <aficiones>
    <aficion titulo="Fotografía analógica">Revelar carretes en casa.</aficion>
  </aficiones>
</sitio>
